{
  "schema_version": "bridge.benchmark.artifact.v1",
  "terminology_version": "bridge.terminology.v1",
  "suite_id": "h",
  "execution_id": "1784181792430-6e69b213986beee00213",
  "output_directory": "artifacts/h/1784181792430-6e69b213986beee00213",
  "run_metadata": {
    "scenario_schema_version": "bridge.benchmark.v1",
    "started_at": "2026-07-16T06:03:12.429776085Z",
    "completed_at": "2026-07-16T06:03:12.432646176Z",
    "duration_ms": 2.87,
    "execution_succeeded": true,
    "observation_mode": "minimum"
  },
  "execution": {
    "randomized": false,
    "run_order": [
      "g/dijkstra/g/seed-1/q/rep-1",
      "g/anchor/g/seed-1/q/rep-1"
    ]
  },
  "environment": {
    "go_version": "go1.23.2",
    "goos": "linux",
    "goarch": "amd64",
    "cpus": 56,
    "captured_at": "2026-07-16T06:03:12.429947776Z"
  },
  "runs": [
    {
      "run_metadata": {
        "run_ordinal": 1,
        "run_id": "g/dijkstra/g/seed-1/q/rep-1",
        "run_name": "g/dijkstra/g/seed-1/q/rep-1",
        "scenario_id": "g",
        "graph_instance_id": "g/seed-1",
        "query_id": "q",
        "algorithm_id": "dijkstra",
        "execution_seed": 1,
        "repetition_index": 1,
        "warmup_run": false,
        "execution_started_at": "2026-07-16T06:03:12.430390049Z",
        "execution_succeeded": true,
        "stable_digest": "6e09a16b0fa078e8da65e5554a4a37357fe426943db2bc2cdf78dd4c381f78e9"
      },
      "scenario_definition": {
        "scenario_id": "g",
        "graph_generator": "grid",
        "graph_generator_settings": {
          "generator": "grid",
          "requested_node_count": 9,
          "topology": "open"
        },
        "route_configuration": {
          "mode": "balanced",
          "logical_worker_count": 1
        },
        "budget_configuration": {},
        "ablation_configuration": {},
        "query_selection_method": "generator_default",
        "observation_mode": "minimum"
      },
      "graph_profile": {
        "graph_instance_id": "g/seed-1",
        "graph_generator": "grid",
        "graph_topology": "open",
        "graph_seed": 1,
        "actual_node_count": 9,
        "edge_count": 12,
        "directed": false,
        "average_out_degree": 1.3333333333333333,
        "edge_density": 0.3333333333333333
      },
      "query_profile": {
        "query_id": "q",
        "query_seed": 1,
        "query_hash": "22efbb92ff106dbcfb66999b6c3675e4a1b47f7f39331bb9b4d10ce6d10d0d53",
        "query_selection_method": "generator_default",
        "source": 0,
        "target": 8
      },
      "algorithm_configuration": {
        "algorithm_id": "dijkstra",
        "execution_path": "execute_once",
        "target_kind": "bolts_solver",
        "route_configuration": {
          "mode": "balanced",
          "logical_worker_count": 1
        },
        "budget_configuration": {},
        "ablation_configuration": {}
      },
      "execution_result": {
        "returned_path": [
          0,
          3,
          6,
          7,
          8
        ],
        "path_found": true,
        "search_completed": true,
        "reachability_proven": true,
        "optimality_proven": true,
        "path_cost": 4.071663072768391,
        "termination_reason": "path_returned",
        "improvement_count": 0,
        "quality_claims": {
          "quality_bound_proven": false
        }
      },
      "measurement": {
        "work": {
          "total_actions": 88,
          "select_actions": 10,
          "expand_actions": 9,
          "evaluate_actions": 22,
          "relax_actions": 22,
          "enqueue_actions": 10,
          "reject_actions": 14,
          "backtrack_actions": 0,
          "connect_actions": 0,
          "candidate_actions": 0,
          "repair_actions": 0,
          "bound_actions": 0,
          "terminate_actions": 1,
          "hypothesis_actions": 0,
          "evidence_actions": 0,
          "handoff_actions": 0,
          "schedule_actions": 0,
          "logical_steps": 88,
          "scheduled_steps": 88,
          "logical_worker_count": 1
        },
        "time_breakdown": {
          "total_ns": 59167,
          "solver_ns": 19429,
          "truss_ns": 59167,
          "gate_ns": 535696,
          "total_ms": 0.059167,
          "solver_ms": 0.019429,
          "truss_ms": 0.059167,
          "bolts_ms": 0.019429,
          "gate_ms": 0.535696
        },
        "system_metrics": {
          "alloc_bytes": 17688,
          "malloc_count": 150,
          "gc_count": 0,
          "heap_alloc_before": 633456,
          "heap_alloc_after": 651144,
          "heap_alloc_boundary_max": 651144
        },
        "solver_time_ns": 19429,
        "end_to_end_time_ns": 660569,
        "solver_time_ms": 0.019429,
        "end_to_end_time_ms": 0.660569,
        "zero_duration": false,
        "timing_valid": true
      },
      "observations": {
        "collector_metrics": {
          "event_count": 18,
          "dropped_events": 0,
          "truncated": false,
          "first_sequence": 1,
          "last_sequence": 18,
          "observation_ns": 24036,
          "sink_write_ns": 0,
          "summary": {
            "event_count": 18,
            "first_sequence": 1,
            "last_sequence": 18,
            "kind_counts": {
              "component_finished": 1,
              "component_started": 1,
              "lifecycle": 16
            },
            "phase_counts": {
              "completed": 8,
              "orchestration": 2,
              "started": 8
            },
            "max_logical_step": 0
          },
          "debug_summary": {
            "candidate_update_count": 0,
            "fallback_count": 0,
            "certification_count": 0,
            "state_reuse_applied_count": 0,
            "max_frontier_size": 0,
            "component_event_counts": {
              "BOLTS": 2,
              "GATE": 6,
              "TRAFFIC": 8
            }
          },
          "spans": {
            "completed": [
              {
                "run_id": "g/dijkstra/g/seed-1/q/rep-1",
                "span_id": "TRAFFIC-1",
                "component": "TRAFFIC",
                "operation": "graph_generation",
                "started_ns": 12679,
                "completed_ns": 160971,
                "duration_ns": 148292
              },
              {
                "run_id": "g/dijkstra/g/seed-1/q/rep-1",
                "span_id": "TRAFFIC-3",
                "parent_span_id": "TRAFFIC-2",
                "component": "TRAFFIC",
                "operation": "query_generation",
                "started_ns": 165798,
                "completed_ns": 166429,
                "duration_ns": 631
              },
              {
                "run_id": "g/dijkstra/g/seed-1/q/rep-1",
                "span_id": "TRAFFIC-4",
                "parent_span_id": "TRAFFIC-2",
                "component": "TRAFFIC",
                "operation": "graph_conversion",
                "started_ns": 169984,
                "completed_ns": 178787,
                "duration_ns": 8803
              },
              {
                "run_id": "g-dijkstra-1-q-1",
                "span_id": "GATE-6",
                "parent_span_id": "GATE-5",
                "component": "GATE",
                "operation": "graph_build",
                "started_ns": 660684,
                "completed_ns": 1110113,
                "duration_ns": 449429
              },
              {
                "span_id": "BOLTS-8",
                "component": "BOLTS",
                "operation": "dijkstra",
                "started_ns": 1152885,
                "completed_ns": 1182769,
                "duration_ns": 29884
              },
              {
                "run_id": "g-dijkstra-1-q-1",
                "span_id": "GATE-7",
                "parent_span_id": "GATE-5",
                "component": "GATE",
                "operation": "dispatch",
                "started_ns": 1113508,
                "completed_ns": 1190841,
                "duration_ns": 77333
              },
              {
                "run_id": "g-dijkstra-1-q-1",
                "span_id": "GATE-5",
                "component": "GATE",
                "operation": "execute_once_request",
                "started_ns": 658290,
                "completed_ns": 1192473,
                "duration_ns": 534183
              },
              {
                "run_id": "g/dijkstra/g/seed-1/q/rep-1",
                "span_id": "TRAFFIC-2",
                "component": "TRAFFIC",
                "operation": "benchmark_run",
                "started_ns": 164697,
                "completed_ns": 1383318,
                "duration_ns": 1218621
              }
            ],
            "incomplete": 0,
            "duplicate_start": 0,
            "orphan_complete": 0
          }
        }
      },
      "references": {
        "graph_specification": {
          "generator": "grid",
          "requested_node_count": 9,
          "topology": "open"
        }
      }
    },
    {
      "run_metadata": {
        "run_ordinal": 2,
        "run_id": "g/anchor/g/seed-1/q/rep-1",
        "run_name": "g/anchor/g/seed-1/q/rep-1",
        "scenario_id": "g",
        "graph_instance_id": "g/seed-1",
        "query_id": "q",
        "algorithm_id": "anchor",
        "execution_seed": 1,
        "repetition_index": 1,
        "warmup_run": false,
        "execution_started_at": "2026-07-16T06:03:12.432209101Z",
        "execution_succeeded": true,
        "stable_digest": "0dc789a833625d5917a2208c2e47fbc222bdc31a463c3f4cc0ee6074375f0d67"
      },
      "scenario_definition": {
        "scenario_id": "g",
        "graph_generator": "grid",
        "graph_generator_settings": {
          "generator": "grid",
          "requested_node_count": 9,
          "topology": "open"
        },
        "route_configuration": {
          "mode": "balanced",
          "logical_worker_count": 1
        },